{
  "$schema": "https://json-schema.org/draft/2020-12/schema",
  "$id": "https://open-artifacts.dev/artifact-packages/video-editor/input.schema.json",
  "title": "Video Editor input",
  "type": "object",
  "additionalProperties": false,
  "required": ["project", "media", "timeline", "delivery"],
  "properties": {
    "project": {
      "type": "object",
      "additionalProperties": false,
      "required": ["name", "sequence"],
      "properties": {
        "name": { "type": "string", "minLength": 1 },
        "sequence": { "type": "string", "minLength": 1 }
      }
    },
    "media": {
      "type": "object",
      "additionalProperties": false,
      "required": ["id", "title", "kind", "durationUs", "dimensions"],
      "properties": {
        "id": { "type": "string", "minLength": 1 },
        "title": { "type": "string", "minLength": 1 },
        "kind": { "type": "string", "minLength": 1 },
        "durationUs": { "type": "integer", "minimum": 1, "maximum": 9007199254740991 },
        "dimensions": { "type": "string", "minLength": 1 }
      }
    },
    "timeline": {
      "type": "object",
      "additionalProperties": false,
      "required": ["id", "title", "trackId", "trackLabel", "clipId"],
      "properties": {
        "id": { "type": "string", "minLength": 1 },
        "title": { "type": "string", "minLength": 1 },
        "trackId": { "type": "string", "minLength": 1 },
        "trackLabel": { "type": "string", "minLength": 1 },
        "clipId": { "type": "string", "minLength": 1 }
      }
    },
    "delivery": {
      "type": "object",
      "additionalProperties": false,
      "required": ["treatments", "targetPlatform", "aspectRatio"],
      "properties": {
        "treatments": {
          "type": "array",
          "uniqueItems": true,
          "items": {
            "type": "string",
            "enum": ["tighten-pacing", "captions", "music-bed"]
          }
        },
        "targetPlatform": {
          "type": "string",
          "enum": ["tiktok", "instagram-reels", "youtube-shorts"]
        },
        "aspectRatio": {
          "type": "string",
          "enum": ["9:16", "1:1", "16:9"]
        }
      }
    }
  }
}
