{
  "project": {
    "name": "First light assembly",
    "sequence": "OA / EDIT 001"
  },
  "media": {
    "id": "demo-video",
    "title": "Studio opening",
    "kind": "H.264 + AAC",
    "durationUs": 1466667,
    "dimensions": "1280 × 856"
  },
  "timeline": {
    "id": "opening-study",
    "title": "Opening study",
    "trackId": "video-1",
    "trackLabel": "Picture 01",
    "clipId": "opening-clip"
  },
  "delivery": {
    "treatments": ["tighten-pacing"],
    "targetPlatform": "youtube-shorts",
    "aspectRatio": "16:9"
  }
}
